{"capture_revision_id":"81e4985b-3169-49a4-b76c-8316a7145117","notes":[{"detail":"region=behind_sofa","kind":"declared_region","session_timestamp_seconds":20},{"detail":"flag_id=1 kind=coverage","kind":"revisit_flag","session_timestamp_seconds":22}],"schema":"htdt.capture.advisory_notes","schema_version":"1.0.0"}